Name,Slug,Collection ID,Locale ID,Item ID,Archived,Draft,Created On,Updated On,Published On,Description,Service,Image,Active
Agendar uma Consulta,agendar-uma-consulta,66032bafcb53744594432066,65fb2d02af63dc1a4c22777b,6619750b01884d31c9574e45,false,false,Fri Apr 12 2024 17:53:15 GMT+0000 (Coordinated Universal Time),Sun Apr 21 2024 11:02:50 GMT+0000 (Coordinated Universal Time),Sun Mar 09 2025 15:23:29 GMT+0000 (Coordinated Universal Time),"Antes de considerar a colocação de implantes dentários, marque uma consulta na Clínica Ferreira Borges. A nossa equipa irá avaliar a sua saúde oral e as suas necessidades para garantir que os implantes dentários sejam a solução mais adequada.",implantes-dentarios,https://uploads-ssl.webflow.com/65edab180ad493fbc6b6ee2a/661bf99043cf8a7c2abfe280_consultation.jpg,true
Consulta Inicial,consulta-inicial,66032bafcb53744594432066,65fb2d02af63dc1a4c22777b,661bfdb10872119944bd56c9,false,false,Sun Apr 14 2024 16:00:49 GMT+0000 (Coordinated Universal Time),Sun Apr 21 2024 10:56:10 GMT+0000 (Coordinated Universal Time),Sun Mar 09 2025 15:23:29 GMT+0000 (Coordinated Universal Time),Visite a Clínica Ferreira Borges e marque uma consulta de avaliação inicial. Este passo é essencial para avaliar a saúde dos seus dentes e discutir as suas expectativas com o tratamento. O médico dentista irá examinar a sua boca e determinar se o aparelho invisível é a opção mais adequada para si.,aparelho-invisivel,https://uploads-ssl.webflow.com/65edab180ad493fbc6b6ee2a/661bf99043cf8a7c2abfe280_consultation.jpg,true
Início do Tratamento,inicio-do-tratamento,66032bafcb53744594432066,65fb2d02af63dc1a4c22777b,661bfe7d7a14900ef3a38d73,false,false,Sun Apr 14 2024 16:04:13 GMT+0000 (Coordinated Universal Time),Sun Apr 21 2024 11:03:49 GMT+0000 (Coordinated Universal Time),Sun Mar 09 2025 15:23:29 GMT+0000 (Coordinated Universal Time),"Uma vez aprovado o plano de tratamento, os seus alinhadores invisíveis serão fabricados especificamente para os seus dentes. Quando estiverem prontos, você retornará à clínica para receber os seus alinhadores. O médico dentista irá guiá-lo sobre como utilizá-los corretamente para garantir o melhor resultado possível.",aparelho-invisivel,https://uploads-ssl.webflow.com/65edab180ad493fbc6b6ee2a/661bfe7988e6101d823b74f2_clear_aligners.jpg,true
Planeamento Personalizado,planeamento-personalizado,66032bafcb53744594432066,65fb2d02af63dc1a4c22777b,661bfde50db9efe639ae9378,false,false,Sun Apr 14 2024 16:01:41 GMT+0000 (Coordinated Universal Time),Sun Apr 21 2024 10:55:30 GMT+0000 (Coordinated Universal Time),Sun Mar 09 2025 15:23:29 GMT+0000 (Coordinated Universal Time),"Após a consulta inicial, se for elegível para o tratamento ortodôntico com aparelho invisível, o próximo passo será criar um plano digital personalizado. Utilizando tecnologia avançada, a clínica irá desenvolver uma representação detalhada do processo de alinhamento dos seus dentes, permitindo que veja os resultados esperados antes mesmo de começar o tratamento.",aparelho-invisivel,https://uploads-ssl.webflow.com/65edab180ad493fbc6b6ee2a/661bf9a0665efc574030b5c5_tretment_planning.jpg,true
Planeamento Personalizado em Tratamento com Implantes,planeamento-personalizado-em-tratamento-com-implantes,66032bafcb53744594432066,65fb2d02af63dc1a4c22777b,66197530f0cc1cef2ddecd03,false,false,Fri Apr 12 2024 17:53:52 GMT+0000 (Coordinated Universal Time),Sun Apr 21 2024 11:00:14 GMT+0000 (Coordinated Universal Time),Sun Mar 09 2025 15:23:29 GMT+0000 (Coordinated Universal Time),"Após a consulta inicial, elaboraremos um plano de tratamento personalizado para você. Utilizando tecnologia de ponta, preparamos um procedimento de implante preciso e confortável.",implantes-dentarios,https://uploads-ssl.webflow.com/65edab180ad493fbc6b6ee2a/661bf9a0665efc574030b5c5_tretment_planning.jpg,true
Procedimento da Colocação do Implante,procedimento-da-colocacao-do-implante,66032bafcb53744594432066,65fb2d02af63dc1a4c22777b,661975493f3e1024a44aa916,false,false,Fri Apr 12 2024 17:54:17 GMT+0000 (Coordinated Universal Time),Sun Apr 21 2024 11:01:13 GMT+0000 (Coordinated Universal Time),Sun Mar 09 2025 15:23:29 GMT+0000 (Coordinated Universal Time),"Experimente um procedimento transformador com o mínimo desconforto na Clínica Ferreira Borges. A nossa equipa de cirurgia oral e implantologia irá guiá-lo(a) por todo o processo de colocação de implante, desde a sua inserção até à sua recuperação, garantindo os melhores resultados e um sorriso rejuvenescido.",implantes-dentarios,https://uploads-ssl.webflow.com/65edab180ad493fbc6b6ee2a/661bf9b688e6101d8236eaeb_pacement.jpg,true
