Name,Slug,Collection ID,Locale ID,Item ID,Archived,Draft,Created On,Updated On,Published On,Description,Image,Service,Active
Uma Jornada Personalizada para a Saúde Bucal,uma-jornada-personalizada-para-a-saude-bucal,6601f0ae27ec5387c01512a7,65fb2d02af63dc1a4c22777b,660f0258700bc2191f863ef3,false,false,Thu Apr 04 2024 19:41:12 GMT+0000 (Coordinated Universal Time),Sun Apr 21 2024 12:03:01 GMT+0000 (Coordinated Universal Time),Sun Mar 09 2025 15:23:29 GMT+0000 (Coordinated Universal Time),"Na nossa clínica, cada jornada de cirurgia oral começa com uma compreensão profunda das suas necessidades únicas. Utilizando as mais recentes inovações em diagnóstico e tratamento, os nossos especialistas estão dedicados a fornecer soluções personalizadas que vão além das suas expectativas. Acreditamos que uma comunicação aberta e honesta é a chave para alcançar resultados excepcionais, permitindo-nos criar um plano de tratamento único e desenhado à medida do paciente.",https://uploads-ssl.webflow.com/65edab180ad493fbc6b6ee2a/660f25c2393dda00aa776af6_intro_oral_surgery.jpg,cirurgia-oral,true
Uma Nova Era na Reabilitação Oral,uma-nova-era-na-reabilitacao-oral,6601f0ae27ec5387c01512a7,65fb2d02af63dc1a4c22777b,660f0839a00fae6e84c35697,false,false,Thu Apr 04 2024 20:06:17 GMT+0000 (Coordinated Universal Time),Sun Apr 21 2024 11:59:29 GMT+0000 (Coordinated Universal Time),Sun Mar 09 2025 15:23:29 GMT+0000 (Coordinated Universal Time),"Na nossa clínica, a reabilitação oral é sinónimo de inovação e cuidado personalizado. Combinamos técnicas avançadas e materiais da mais alta qualidade para reconstruir sorrisos de maneira eficaz e duradoura. Cada plano de tratamento é meticulosamente desenhado para corresponder à situação específica do paciente, com o objetivo de restaurar não só a funcionalidade plena da boca, mas também a estética natural do sorriso. Este compromisso com a excelência e a atenção aos detalhes são o que nos torna líderes em reabilitação oral.",https://uploads-ssl.webflow.com/65edab180ad493fbc6b6ee2a/660f081b8de33ff8622be469_intro_restoration.jpg,reabilitacao,true
Uma Nova Era para o Seu Sorriso,uma-nova-era-para-o-seu-sorriso,6601f0ae27ec5387c01512a7,65fb2d02af63dc1a4c22777b,660da7133cfb9d59781ac3ed,false,false,Wed Apr 03 2024 18:59:31 GMT+0000 (Coordinated Universal Time),Sun Apr 21 2024 12:18:19 GMT+0000 (Coordinated Universal Time),Sun Mar 09 2025 15:23:29 GMT+0000 (Coordinated Universal Time),"Num mundo onde a primeira impressão conta mais do que nunca, um sorriso bonito e saudável é a sua carta de apresentação. A Restauração Estética na Clínica Ferreira Borges utiliza as mais recentes tecnologias para corrigir imperfeições, como dentes partidos, manchados ou desalinhados, transformando não apenas o seu sorriso, mas também a sua autoestima. Permita-se embarcar nesta viagem transformadora, onde cada tratamento é adaptado às suas necessidades únicas, garantindo resultados naturais e duradouros.",https://uploads-ssl.webflow.com/65edab180ad493fbc6b6ee2a/660efdc7dcca4cd473fde83c_intro_cosmetic_dentistry3.jpg,restauracao-estetica,true
Uma Solução Duradoura para um Sorriso Perfeito,o-que-sao-implantes-dentarios,6601f0ae27ec5387c01512a7,65fb2d02af63dc1a4c22777b,66033815ade6726c535fac1e,false,false,Tue Mar 26 2024 21:03:17 GMT+0000 (Coordinated Universal Time),Sun Apr 21 2024 12:38:58 GMT+0000 (Coordinated Universal Time),Sun Mar 09 2025 15:23:29 GMT+0000 (Coordinated Universal Time),"Os implantes dentários são a alternativa mais próxima que temos aos dentes naturais. Eles são desenhados para se integrarem perfeitamente com o osso, criando uma fundação sólida que pode durar uma vida. Ao escolher os implantes dentários na Clínica Ferreira Borges, você não está apenas a investir num sorriso bonito, mas também na sua saúde oral geral. A nossa equipa dedicada utiliza as últimas tecnologias e técnicas para assegurar que o seu tratamento seja um sucesso completo, devolvendo-lhe a confiança de sorrir sem reservas.",https://uploads-ssl.webflow.com/65edab180ad493fbc6b6ee2a/6616d6db79ad3664d2c21275_intro_implants1.jpg,implantes-dentarios,true
Viva Sem Limitações,viva-sem-limitacoes,6601f0ae27ec5387c01512a7,65fb2d02af63dc1a4c22777b,660348f622f60ac2cc4cb0c0,false,false,Tue Mar 26 2024 22:15:18 GMT+0000 (Coordinated Universal Time),Sun Apr 21 2024 12:36:00 GMT+0000 (Coordinated Universal Time),Sun Mar 09 2025 15:23:29 GMT+0000 (Coordinated Universal Time),"Com o aparelho invisível, não precisa de mudar a sua rotina. Ao contrário dos aparelhos ortodônticos tradicionais, pode comer, beber, higienizar os dentes sem qualquer inconveniente. A sua transparência e conforto permitem que continue a sua vida social, profissional e pessoal sem interrupções. Além disso, como é removível, o paciente tem total controle sobre o seu tratamento, podendo retirá-lo em momentos especiais, garantindo assim, não só um tratamento eficaz, mas também uma experiência sem complicações.",https://uploads-ssl.webflow.com/65edab180ad493fbc6b6ee2a/6616c1bff4d019fc0dba84fb_intro_clear_aligners7.jpg,aparelho-invisivel,true
